{
  "profile": "ualf-capture/v1.1",
  "organization": "org-ualf-demo",
  "project": "proj-03",
  "environment": "test",
  "run_id": "run-2026-08-02-demo-001",
  "trace_id": "trace-2026-08-02-demo-001",
  "trace_sha256": "7f4a640390689408230b251ac5ca838b1b731face9f331dab140a482229dede8",
  "created_at": "2026-08-03T12:00:00Z",
  "sampling": {
    "decision": "keep",
    "probability": 1.0,
    "policy": "ualf-demo-sampling/v1",
    "reason": "manual",
    "scope": "root_trace"
  },
  "content_states": {
    "inputs": "captured",
    "outputs": "captured",
    "system_messages": "captured",
    "developer_messages": "not_applicable",
    "tool_definitions": "captured",
    "tool_arguments": "captured",
    "tool_results": "captured",
    "reasoning": "captured",
    "images": "not_applicable",
    "audio": "not_applicable",
    "embeddings": "not_applicable",
    "provider_payloads": "not_available"
  },
  "privacy": {
    "policy": "ualf-demo-redaction/v1",
    "boundary": "client",
    "pre_persistence": true,
    "secrets_scan": "clean"
  },
  "delivery": {
    "mode": "durable_spool",
    "queue_capacity": 1024,
    "queue_high_watermark": 8,
    "accepted_records": 20,
    "delivered_records": 20,
    "dropped_records": 0,
    "retry_count": 0,
    "terminal_failures": 0,
    "spool": "durable",
    "flush_status": "completed",
    "flush_deadline_ms": 5000
  },
  "clock": {
    "wall_source": "system_utc",
    "monotonic_source": "steady_clock",
    "synchronization": "synthetic-fixture",
    "synchronized": true,
    "max_drift_ms": 1.0
  },
  "recovery": {
    "status": "clean",
    "accepted_records_lost": 0,
    "closer": "example-agent"
  },
  "completeness": "complete",
  "seal": {
    "key_id": "ualf-capture-demo-1",
    "algorithm": "ed25519",
    "public_key": "nl9+oqwbuBK04CmVKnk0pJEUON8Yp4yxEfCzgCD1HLU=",
    "document_sha256": "0389aa3408a6bfc357cd610ae81f882d06385e3bf047f3fc00a8b50fe89bf3c5",
    "signature": "dv/7nUukjZsusNuv8V/6q7OpjEUJlnftsVETyvout2+dDuMfmdUUFRBGoMZxhivkIRVk2UMzVpLL4BdZ8xZ8Cg=="
  }
}
